{
  "schema_version": "0.1",
  "archive_version": "0.1",
  "archive_type": "notices",
  "archive_month": "2022-11",
  "last_modified_at": "2026-06-05T10:35:31+09:00",
  "timezone": "Asia/Seoul",
  "item_count": 1,
  "source_counts": {
    "pnu-job-notices": 1
  },
  "items": [
    {
      "id": "pnu-job-notices:200028",
      "url": "https://job.pusan.ac.kr/ko/notice/notice/view/200028?p=1",
      "title": "[신 AI역량검사를 무료로 이용하세요]",
      "content_text": "This feed does not mirror the full notice body. Fetch the original notice URL for complete content.",
      "summary": null,
      "date_published": "2022-11-08T00:00:00+09:00",
      "_pnu": {
        "source_id": "pnu-job-notices",
        "source_name": "부산대 취업전략과 공지사항",
        "published_at": "2022-11-08",
        "fetched_at": "2026-06-05T10:35:31+09:00",
        "snippet": null,
        "content_access": {
          "detail_url": "https://job.pusan.ac.kr/ko/notice/notice/view/200028?p=1",
          "requires_login": false,
          "content_mirrored": false,
          "attachments_mirrored": false
        },
        "attachments": [],
        "tags": [
          "pnu",
          "official",
          "career",
          "job_notice"
        ],
        "content_hash": "057ce09168b1ba8d37e6debf926e514fae709d13301b4882fa81037bad7a8316"
      },
      "_archive": {
        "archive_month": "2022-11",
        "first_seen_at": "2026-06-05T10:35:31+09:00",
        "last_seen_at": "2026-06-05T10:35:31+09:00",
        "last_changed_at": "2026-06-05T10:35:31+09:00",
        "current_content_hash": "057ce09168b1ba8d37e6debf926e514fae709d13301b4882fa81037bad7a8316"
      }
    }
  ]
}
