{
  "schema_version": "0.1",
  "archive_version": "0.1",
  "archive_type": "notices",
  "archive_month": "2020-04",
  "last_modified_at": "2026-06-05T10:35:31+09:00",
  "timezone": "Asia/Seoul",
  "item_count": 1,
  "source_counts": {
    "pnu-international-student-notices": 1
  },
  "items": [
    {
      "id": "pnu-international-student-notices:1362360",
      "url": "https://international.pusan.ac.kr/bbs/international/2081/1362360/artclView.do",
      "title": "결핵진단서 제출(결핵고위험국가 대상) To submit TB test result(for Tuberculo",
      "content_text": "This feed does not mirror the full notice body. Fetch the original notice URL for complete content.",
      "summary": null,
      "date_published": "2020-04-03T00:00:00+09:00",
      "_pnu": {
        "source_id": "pnu-international-student-notices",
        "source_name": "부산대 국제처 외국인학생 공지사항",
        "published_at": "2020-04-03",
        "fetched_at": "2026-06-05T10:35:31+09:00",
        "snippet": null,
        "content_access": {
          "detail_url": "https://international.pusan.ac.kr/bbs/international/2081/1362360/artclView.do",
          "requires_login": false,
          "content_mirrored": false,
          "attachments_mirrored": false
        },
        "attachments": [],
        "tags": [
          "pnu",
          "official",
          "international",
          "international_students"
        ],
        "content_hash": "fe6674f693a227b7314a83bb200d72fe7edee4ea5b9598458d94ad1a9484d9b6"
      },
      "_archive": {
        "archive_month": "2020-04",
        "first_seen_at": "2026-06-05T10:35:31+09:00",
        "last_seen_at": "2026-06-05T10:35:31+09:00",
        "last_changed_at": "2026-06-05T10:35:31+09:00",
        "current_content_hash": "fe6674f693a227b7314a83bb200d72fe7edee4ea5b9598458d94ad1a9484d9b6"
      }
    }
  ]
}
