{
  "schema_version": "0.1",
  "archive_version": "0.1",
  "archive_type": "notices",
  "archive_month": "2025-10",
  "last_modified_at": "2026-06-04T22:23:14+09:00",
  "timezone": "Asia/Seoul",
  "item_count": 2,
  "source_counts": {
    "pnu-onestop-scholarship": 2
  },
  "items": [
    {
      "id": "pnu-onestop-scholarship:650",
      "url": "https://onestop.pusan.ac.kr/page?menuCD=000000000000062&mode=DETAIL&seq=650",
      "title": "2025학년도 2학기 장학사정관 추천 학업지원장학생 선발 안내",
      "content_text": "This feed does not mirror the full notice body. Fetch the original notice URL for complete content.",
      "summary": "실제 가정형편이 곤란함에도 장학금을 지원받지 못하는 학생들을 지원하기 위해 장학사정관의 추천을 통해 장학생을 다음과 같이 선발하고자 하오니 , 선발기준에 해당되는 학생들은 신청해 주시기 바랍니다 . 1. 신청대상 ( 세부사항은 [ 붙임 ] 의 선발계획 참조 ) ( 학부생 ) 2025 학년도 2 학기 재학 중인 정규학기 학생 중 직전학기 성적 2.0 이상 및 이수학점 12 학점 이상으로 가계곤란 사유에 해당하는 학생 ( 일반대학원생 ) 2025 학년도 2 학기 재학 중인 정규학기 학생 중 직전학기 성적 3.0 이상으로 가계곤란 사유에 해당하는 학생 2. 지원금액 : 가계곤란 정도에 따라 차등 금액 지급 ( 등록금에 한함 ) ※ 2025 학년도 2 학기 등록금을 전액 감면 ( 등록금 전액 장학생 ) 받은 경우 지원 불가 3. 신청기간 : 2025. 10. 20.( 월 ) ~ 11. 14.( 금 ) 까지 4. 신청방법 : 학생과 방문 제출 ( 대학 본관 2 층 ) 또는 e-mail 제출 ",
      "date_published": "2025-10-16T00:00:00+09:00",
      "_pnu": {
        "source_id": "pnu-onestop-scholarship",
        "source_name": "부산대 장학공지",
        "published_at": "2025-10-16",
        "fetched_at": "2026-06-04T22:23:14+09:00",
        "snippet": "실제 가정형편이 곤란함에도 장학금을 지원받지 못하는 학생들을 지원하기 위해 장학사정관의 추천을 통해 장학생을 다음과 같이 선발하고자 하오니 , 선발기준에 해당되는 학생들은 신청해 주시기 바랍니다 . 1. 신청대상 ( 세부사항은 [ 붙임 ] 의 선발계획 참조 ) ( 학부생 ) 2025 학년도 2 학기 재학 중인 정규학기 학생 중 직전학기 성적 2.0 이상 및 이수학점 12 학점 이상으로 가계곤란 사유에 해당하는 학생 ( 일반대학원생 ) 2025 학년도 2 학기 재학 중인 정규학기 학생 중 직전학기 성적 3.0 이상으로 가계곤란 사유에 해당하는 학생 2. 지원금액 : 가계곤란 정도에 따라 차등 금액 지급 ( 등록금에 한함 ) ※ 2025 학년도 2 학기 등록금을 전액 감면 ( 등록금 전액 장학생 ) 받은 경우 지원 불가 3. 신청기간 : 2025. 10. 20.( 월 ) ~ 11. 14.( 금 ) 까지 4. 신청방법 : 학생과 방문 제출 ( 대학 본관 2 층 ) 또는 e-mail 제출 ",
        "content_access": {
          "detail_url": "https://onestop.pusan.ac.kr/page?menuCD=000000000000062&mode=DETAIL&seq=650",
          "requires_login": false,
          "content_mirrored": false,
          "attachments_mirrored": false
        },
        "attachments": [
          {
            "name": "2025학년도 2학기 장학사정관 추천 학업지원장학생 선발계획(안).pdf",
            "url": "https://onestop.pusan.ac.kr/file/download.do?KROm6Tykivp5vzOW0h0NoUh1pPyoUksUjsYUIFgPdCXga0sRUUui63o1DCf4OV/lRbhnyER6mLU4fLygXOW5ARnr/7l94btNNXKPK7cSn7I=",
            "download_url": "https://onestop.pusan.ac.kr/file/download.do?KROm6Tykivp5vzOW0h0NoUh1pPyoUksUjsYUIFgPdCXga0sRUUui63o1DCf4OV/lRbhnyER6mLU4fLygXOW5ARnr/7l94btNNXKPK7cSn7I=",
            "type": "pdf",
            "media_type": "application/pdf",
            "file_extension": "pdf"
          },
          {
            "name": "1. 2025년도 2학기 장학사정관 추천 장학금 신청서(학부).hwp",
            "url": "https://onestop.pusan.ac.kr/file/download.do?KROm6Tykivp5vzOW0h0NoUh1pPyoUksUjsYUIFgPdCUatuyiqZQNX5bExLYMDsL4yHedR6o96yizJ7iEnyOCGtDUfGcpr1/LwhrnEOotO1M=",
            "download_url": "https://onestop.pusan.ac.kr/file/download.do?KROm6Tykivp5vzOW0h0NoUh1pPyoUksUjsYUIFgPdCUatuyiqZQNX5bExLYMDsL4yHedR6o96yizJ7iEnyOCGtDUfGcpr1/LwhrnEOotO1M=",
            "type": "hwp",
            "media_type": "application/x-hwp",
            "file_extension": "hwp"
          },
          {
            "name": "2. 2025학년도 2학기 장학사정관 추천 장학금 신청서(일반대학원).hwp",
            "url": "https://onestop.pusan.ac.kr/file/download.do?KROm6Tykivp5vzOW0h0NoUh1pPyoUksUjsYUIFgPdCVhBUug7WEqY5r4yD26EFP8H1L2HQDuBExpPUYgRVKtSp3pmMg0CJEu2vRaBGxw8m0=",
            "download_url": "https://onestop.pusan.ac.kr/file/download.do?KROm6Tykivp5vzOW0h0NoUh1pPyoUksUjsYUIFgPdCVhBUug7WEqY5r4yD26EFP8H1L2HQDuBExpPUYgRVKtSp3pmMg0CJEu2vRaBGxw8m0=",
            "type": "hwp",
            "media_type": "application/x-hwp",
            "file_extension": "hwp"
          },
          {
            "name": "3. 가계곤란 사유서(장학사정관).hwp",
            "url": "https://onestop.pusan.ac.kr/file/download.do?KROm6Tykivp5vzOW0h0NoUh1pPyoUksUjsYUIFgPdCXQ630XQzEpFqdelpYsekcqs2B1zYAraHrU3eoozO1CKuPB9J27pjh0/p7tOLqhypw=",
            "download_url": "https://onestop.pusan.ac.kr/file/download.do?KROm6Tykivp5vzOW0h0NoUh1pPyoUksUjsYUIFgPdCXQ630XQzEpFqdelpYsekcqs2B1zYAraHrU3eoozO1CKuPB9J27pjh0/p7tOLqhypw=",
            "type": "hwp",
            "media_type": "application/x-hwp",
            "file_extension": "hwp"
          },
          {
            "name": "4. 개인정보 수집.이용 동의서(장학사정관).hwp",
            "url": "https://onestop.pusan.ac.kr/file/download.do?KROm6Tykivp5vzOW0h0NoUh1pPyoUksUjsYUIFgPdCXyzmuxaRWQtEg7zZ62SH707kaPk8NXiqOYcnLYAC5uLa+jDAf4/3PycHC7sRVhmOg=",
            "download_url": "https://onestop.pusan.ac.kr/file/download.do?KROm6Tykivp5vzOW0h0NoUh1pPyoUksUjsYUIFgPdCXyzmuxaRWQtEg7zZ62SH707kaPk8NXiqOYcnLYAC5uLa+jDAf4/3PycHC7sRVhmOg=",
            "type": "hwp",
            "media_type": "application/x-hwp",
            "file_extension": "hwp"
          },
          {
            "name": "5. 서약서.hwp",
            "url": "https://onestop.pusan.ac.kr/file/download.do?KROm6Tykivp5vzOW0h0NoUh1pPyoUksUjsYUIFgPdCXN5xZvEJ8nyd1yuyRjnsH7WEibLYUQBISTokr4iozLHfqAEUEtE1m/lEh/F4M7Xs4=",
            "download_url": "https://onestop.pusan.ac.kr/file/download.do?KROm6Tykivp5vzOW0h0NoUh1pPyoUksUjsYUIFgPdCXN5xZvEJ8nyd1yuyRjnsH7WEibLYUQBISTokr4iozLHfqAEUEtE1m/lEh/F4M7Xs4=",
            "type": "hwp",
            "media_type": "application/x-hwp",
            "file_extension": "hwp"
          }
        ],
        "tags": [
          "pnu",
          "official",
          "onestop",
          "scholarship"
        ],
        "content_hash": "0cddd482adfcc06d7dc2cc2ce02cf711c2fb130d9153ad7d7b358cdfa789d51c"
      },
      "_archive": {
        "archive_month": "2025-10",
        "first_seen_at": "2026-06-04T22:23:14+09:00",
        "last_seen_at": "2026-06-04T22:23:14+09:00",
        "last_changed_at": "2026-06-04T22:23:14+09:00",
        "current_content_hash": "0cddd482adfcc06d7dc2cc2ce02cf711c2fb130d9153ad7d7b358cdfa789d51c"
      }
    },
    {
      "id": "pnu-onestop-scholarship:649",
      "url": "https://onestop.pusan.ac.kr/page?menuCD=000000000000062&mode=DETAIL&seq=649",
      "title": "2025학년도 2학기 국가근로장학금 추가 신청 안내",
      "content_text": "This feed does not mirror the full notice body. Fetch the original notice URL for complete content.",
      "summary": "2025 학년도 2 학기 국가근로장학금 추가 신청기간을 아래와 같이 알려드리니 , 해당 학생은 기간 내 신청하여 주시기 바랍니다 . ◎ 신청기간 : 2025. 10. 30.( 목 ) 9 시 ~ 11. 7.( 금 ) 18:00 까지 ◎ 신청방법 : 한국장학재단 홈페이지 (www.kosaf.go.kr) - 국가근로장학금 * 재단홈페이지 > 장학금 > 장학금 신청 > 신청서 작성 ( 학자금유형 : 국가근로장학금 - 일반유형 선택 ) ◎ 신청대상 - 1 차 , 2 차 미신청자로서 동계 방학 중 국가근로를 희망하는 학생 - 2025 년 2 학기 학자금지원구간이 산정된 학생만 신청가능 * 추가 신청기간에 신청한다고 2 학기 추가 선발이 되는 건 아니고 방학 중 근로를 위한 신청기간이며 , 희망근로지 신청기간에 희망근로지를 신청한 학생에 한하여 동계방학 집중근로에 선발이 될 수 있음을 알려드리니 참고하시기 바랍니다 . * 동계방학 집중근로 ( 교외근로 ) 희망근로지 신청기간 : 2025. 11.",
      "date_published": "2025-10-15T00:00:00+09:00",
      "_pnu": {
        "source_id": "pnu-onestop-scholarship",
        "source_name": "부산대 장학공지",
        "published_at": "2025-10-15",
        "fetched_at": "2026-06-04T22:23:14+09:00",
        "snippet": "2025 학년도 2 학기 국가근로장학금 추가 신청기간을 아래와 같이 알려드리니 , 해당 학생은 기간 내 신청하여 주시기 바랍니다 . ◎ 신청기간 : 2025. 10. 30.( 목 ) 9 시 ~ 11. 7.( 금 ) 18:00 까지 ◎ 신청방법 : 한국장학재단 홈페이지 (www.kosaf.go.kr) - 국가근로장학금 * 재단홈페이지 > 장학금 > 장학금 신청 > 신청서 작성 ( 학자금유형 : 국가근로장학금 - 일반유형 선택 ) ◎ 신청대상 - 1 차 , 2 차 미신청자로서 동계 방학 중 국가근로를 희망하는 학생 - 2025 년 2 학기 학자금지원구간이 산정된 학생만 신청가능 * 추가 신청기간에 신청한다고 2 학기 추가 선발이 되는 건 아니고 방학 중 근로를 위한 신청기간이며 , 희망근로지 신청기간에 희망근로지를 신청한 학생에 한하여 동계방학 집중근로에 선발이 될 수 있음을 알려드리니 참고하시기 바랍니다 . * 동계방학 집중근로 ( 교외근로 ) 희망근로지 신청기간 : 2025. 11.",
        "content_access": {
          "detail_url": "https://onestop.pusan.ac.kr/page?menuCD=000000000000062&mode=DETAIL&seq=649",
          "requires_login": false,
          "content_mirrored": false,
          "attachments_mirrored": false
        },
        "attachments": [
          {
            "name": "붙임1. 2025년 2학기 국가근로장학금 일반유형(추가) 학생신청 매뉴얼.pdf",
            "url": "https://onestop.pusan.ac.kr/file/download.do?wvYJDpMAUYH1fvVpImkfCVgCGIiElGzEekwOuAZEhAD7aJskgRJ5JvpndmmbPfS+kdB5ibxAqYvVegQOxr9iYzVwZfK9mBpkrEmasQ8e9tU=",
            "download_url": "https://onestop.pusan.ac.kr/file/download.do?wvYJDpMAUYH1fvVpImkfCVgCGIiElGzEekwOuAZEhAD7aJskgRJ5JvpndmmbPfS+kdB5ibxAqYvVegQOxr9iYzVwZfK9mBpkrEmasQ8e9tU=",
            "type": "pdf",
            "media_type": "application/pdf",
            "file_extension": "pdf"
          }
        ],
        "tags": [
          "pnu",
          "official",
          "onestop",
          "scholarship"
        ],
        "content_hash": "dde6aeeba9ca74bddcd2f0ccd78f97bcf143da60c9d572257ae34877e14772f0"
      },
      "_archive": {
        "archive_month": "2025-10",
        "first_seen_at": "2026-06-04T22:23:14+09:00",
        "last_seen_at": "2026-06-04T22:23:14+09:00",
        "last_changed_at": "2026-06-04T22:23:14+09:00",
        "current_content_hash": "dde6aeeba9ca74bddcd2f0ccd78f97bcf143da60c9d572257ae34877e14772f0"
      }
    }
  ]
}
