{
  "schema_version": "0.1",
  "archive_version": "0.1",
  "archive_type": "notices",
  "archive_month": "2025-08",
  "last_modified_at": "2026-06-04T22:23:14+09:00",
  "timezone": "Asia/Seoul",
  "item_count": 1,
  "source_counts": {
    "pnu-onestop-scholarship": 1
  },
  "items": [
    {
      "id": "pnu-onestop-scholarship:647",
      "url": "https://onestop.pusan.ac.kr/page?menuCD=000000000000062&mode=DETAIL&seq=647",
      "title": "2025학년도 2학기 교내 유니웰장학금 대상자(자립준비청년) 신규 신청 안내",
      "content_text": "This feed does not mirror the full notice body. Fetch the original notice URL for complete content.",
      "summary": "2025 학년도 2 학기 학부 유니웰장학금 신규 대상자는 아래와 같이 신청기한 내 장학금을 신청하여 주시기 바랍니다 . 가 . 장학명 : 유니웰 (University Welfare) 장학금 1) 대상자 : 기초 ~ 차상위계층 의 학생 중 아동복지시설 또는 위탁가정 * 에서 거주한 학부생 ( 「 아동복지법 」 제 38 조 제 2 항에 따른 자격요건 해당자 ) * 「 아동복지법 」 에 의거 인가된 아동복지시설 및 위탁가정에서 생활한 자 ( 단 , 「 아동복지법 」 제 16 조 및 16 조의 3 에 따라 보호조치가 종료되거나 해당 시설에서 퇴소한 지 5 년이 지나지 아니한 자 ) ※ 기존 장학생은 재신청할 필요 없음 2) 지원금액 : 등록학기 매월 생활비 장학금 30 만원 3) 지원기준 : 당해학기 재학생 , 직전학기 평점평균 1.8 이상 ( 최소 12 학점 이수 ) . 단 , 신입생 첫학기 무관 . 4) 증빙서류 : ① 보육시설 발급 재원 ( 퇴소 ) 확인서 또는 지자체 발급 가정위탁 ",
      "date_published": "2025-08-28T00:00:00+09:00",
      "_pnu": {
        "source_id": "pnu-onestop-scholarship",
        "source_name": "부산대 장학공지",
        "published_at": "2025-08-28",
        "fetched_at": "2026-06-04T22:23:14+09:00",
        "snippet": "2025 학년도 2 학기 학부 유니웰장학금 신규 대상자는 아래와 같이 신청기한 내 장학금을 신청하여 주시기 바랍니다 . 가 . 장학명 : 유니웰 (University Welfare) 장학금 1) 대상자 : 기초 ~ 차상위계층 의 학생 중 아동복지시설 또는 위탁가정 * 에서 거주한 학부생 ( 「 아동복지법 」 제 38 조 제 2 항에 따른 자격요건 해당자 ) * 「 아동복지법 」 에 의거 인가된 아동복지시설 및 위탁가정에서 생활한 자 ( 단 , 「 아동복지법 」 제 16 조 및 16 조의 3 에 따라 보호조치가 종료되거나 해당 시설에서 퇴소한 지 5 년이 지나지 아니한 자 ) ※ 기존 장학생은 재신청할 필요 없음 2) 지원금액 : 등록학기 매월 생활비 장학금 30 만원 3) 지원기준 : 당해학기 재학생 , 직전학기 평점평균 1.8 이상 ( 최소 12 학점 이수 ) . 단 , 신입생 첫학기 무관 . 4) 증빙서류 : ① 보육시설 발급 재원 ( 퇴소 ) 확인서 또는 지자체 발급 가정위탁 ",
        "content_access": {
          "detail_url": "https://onestop.pusan.ac.kr/page?menuCD=000000000000062&mode=DETAIL&seq=647",
          "requires_login": false,
          "content_mirrored": false,
          "attachments_mirrored": false
        },
        "attachments": [],
        "tags": [
          "pnu",
          "official",
          "onestop",
          "scholarship"
        ],
        "content_hash": "222d3f6d05d50150150dfd077457279d688294a12bbadcab6918a5a22827d21c"
      },
      "_archive": {
        "archive_month": "2025-08",
        "first_seen_at": "2026-06-04T22:23:14+09:00",
        "last_seen_at": "2026-06-04T22:23:14+09:00",
        "last_changed_at": "2026-06-04T22:23:14+09:00",
        "current_content_hash": "222d3f6d05d50150150dfd077457279d688294a12bbadcab6918a5a22827d21c"
      }
    }
  ]
}
