{
  "schema_version": "0.1",
  "archive_version": "0.1",
  "archive_type": "notices",
  "archive_month": "2017-11",
  "last_modified_at": "2026-06-05T10:35:31+09:00",
  "timezone": "Asia/Seoul",
  "item_count": 2,
  "source_counts": {
    "pnu-international-student-notices": 2
  },
  "items": [
    {
      "id": "pnu-international-student-notices:1361761",
      "url": "https://international.pusan.ac.kr/bbs/international/2081/1361761/artclView.do",
      "title": "외국인 등록사항 변경 신고 안내 Report on Changes in Matters Registered by",
      "content_text": "This feed does not mirror the full notice body. Fetch the original notice URL for complete content.",
      "summary": null,
      "date_published": "2017-11-09T00:00:00+09:00",
      "_pnu": {
        "source_id": "pnu-international-student-notices",
        "source_name": "부산대 국제처 외국인학생 공지사항",
        "published_at": "2017-11-09",
        "fetched_at": "2026-06-05T10:35:31+09:00",
        "snippet": null,
        "content_access": {
          "detail_url": "https://international.pusan.ac.kr/bbs/international/2081/1361761/artclView.do",
          "requires_login": false,
          "content_mirrored": false,
          "attachments_mirrored": false
        },
        "attachments": [],
        "tags": [
          "pnu",
          "official",
          "international",
          "international_students"
        ],
        "content_hash": "b8cd1753f797622d5b67270ecbbdaf43394c4028b6c0f160a756cf2f051194d1"
      },
      "_archive": {
        "archive_month": "2017-11",
        "first_seen_at": "2026-06-05T10:35:31+09:00",
        "last_seen_at": "2026-06-05T10:35:31+09:00",
        "last_changed_at": "2026-06-05T10:35:31+09:00",
        "current_content_hash": "b8cd1753f797622d5b67270ecbbdaf43394c4028b6c0f160a756cf2f051194d1"
      }
    },
    {
      "id": "pnu-international-student-notices:1361756",
      "url": "https://international.pusan.ac.kr/bbs/international/2081/1361756/artclView.do",
      "title": "(수정) 시간제취업 안내 (Revised) Application for part-time work permi",
      "content_text": "This feed does not mirror the full notice body. Fetch the original notice URL for complete content.",
      "summary": null,
      "date_published": "2017-11-06T00:00:00+09:00",
      "_pnu": {
        "source_id": "pnu-international-student-notices",
        "source_name": "부산대 국제처 외국인학생 공지사항",
        "published_at": "2017-11-06",
        "fetched_at": "2026-06-05T10:35:31+09:00",
        "snippet": null,
        "content_access": {
          "detail_url": "https://international.pusan.ac.kr/bbs/international/2081/1361756/artclView.do",
          "requires_login": false,
          "content_mirrored": false,
          "attachments_mirrored": false
        },
        "attachments": [],
        "tags": [
          "pnu",
          "official",
          "international",
          "international_students"
        ],
        "content_hash": "2465ac79160f1c915094efcbd8a3f58958c362472f881f4fedc3c589e03ff50f"
      },
      "_archive": {
        "archive_month": "2017-11",
        "first_seen_at": "2026-06-05T10:35:31+09:00",
        "last_seen_at": "2026-06-05T10:35:31+09:00",
        "last_changed_at": "2026-06-05T10:35:31+09:00",
        "current_content_hash": "2465ac79160f1c915094efcbd8a3f58958c362472f881f4fedc3c589e03ff50f"
      }
    }
  ]
}
