{
  "schema_version": "0.1",
  "archive_version": "0.1",
  "archive_type": "notices",
  "archive_month": "2025-09",
  "last_modified_at": "2026-06-04T22:23:14+09:00",
  "timezone": "Asia/Seoul",
  "item_count": 1,
  "source_counts": {
    "pnu-onestop-scholarship": 1
  },
  "items": [
    {
      "id": "pnu-onestop-scholarship:648",
      "url": "https://onestop.pusan.ac.kr/page?menuCD=000000000000062&mode=DETAIL&seq=648",
      "title": "2025년 2학기 중소기업 취업연계 장학사업(희망사다리Ⅰ유형) 신청 안내",
      "content_text": "This feed does not mirror the full notice body. Fetch the original notice URL for complete content.",
      "summary": "2025 년도 2 학기 중소기업 취업연계 장학사업 ( 희망사다리 I 유형 ) 장학생 선발기준 및 취 · 창업지원금 사용 계획서에 취 · 창업 계획서를 별도 작성 ( 평가항목 추가 ) 할 수 있도록 파일을 추가 하였으니 희망하는 학생은 착오없으시기 바랍니다 . 한국장학재단 2025 년도 2 학기 중소기업 취업연계 장학금 ( 희망사다리 Ⅰ 유형 ) 신규장학생 선발을 위한 학생신청 기간을 알려드리니 , 중소 · 중견기업 취업 또는 창업을 희망하는 학생들 중 신청희망자는 기한내 신청하여 주시기 바랍니다 . □ 학생신청 기간 : 2025. 9. 3.( 수 ) ~ 9. 19.( 금 ) 18:00 까지 ※ 본 사업은 신청서 작성 후 온라인사전교육 및 진단평가 이수까지 모두 이수해야 됩니다 . 마감일 최소 하루 전부터 시간을 넉넉히 잡으시어 장학금을 신청하는데 차질이 없으시기 바라며 , 본인의 장학금 신청완료 여부 , 온라인사전교육 이수여부를 꼼꼼히 확인 바랍니다 . ( 신청매뉴얼 필독 ) □ 지",
      "date_published": "2025-09-04T00:00:00+09:00",
      "_pnu": {
        "source_id": "pnu-onestop-scholarship",
        "source_name": "부산대 장학공지",
        "published_at": "2025-09-04",
        "fetched_at": "2026-06-04T22:23:14+09:00",
        "snippet": "2025 년도 2 학기 중소기업 취업연계 장학사업 ( 희망사다리 I 유형 ) 장학생 선발기준 및 취 · 창업지원금 사용 계획서에 취 · 창업 계획서를 별도 작성 ( 평가항목 추가 ) 할 수 있도록 파일을 추가 하였으니 희망하는 학생은 착오없으시기 바랍니다 . 한국장학재단 2025 년도 2 학기 중소기업 취업연계 장학금 ( 희망사다리 Ⅰ 유형 ) 신규장학생 선발을 위한 학생신청 기간을 알려드리니 , 중소 · 중견기업 취업 또는 창업을 희망하는 학생들 중 신청희망자는 기한내 신청하여 주시기 바랍니다 . □ 학생신청 기간 : 2025. 9. 3.( 수 ) ~ 9. 19.( 금 ) 18:00 까지 ※ 본 사업은 신청서 작성 후 온라인사전교육 및 진단평가 이수까지 모두 이수해야 됩니다 . 마감일 최소 하루 전부터 시간을 넉넉히 잡으시어 장학금을 신청하는데 차질이 없으시기 바라며 , 본인의 장학금 신청완료 여부 , 온라인사전교육 이수여부를 꼼꼼히 확인 바랍니다 . ( 신청매뉴얼 필독 ) □ 지",
        "content_access": {
          "detail_url": "https://onestop.pusan.ac.kr/page?menuCD=000000000000062&mode=DETAIL&seq=648",
          "requires_login": false,
          "content_mirrored": false,
          "attachments_mirrored": false
        },
        "attachments": [
          {
            "name": "2025년 2학기 중소기업 취업연계 장학사업(희망사다리Ⅰ유형) 장학생 선발기준.pdf",
            "url": "https://onestop.pusan.ac.kr/file/download.do?gOxJPVM6wqGRMRirENffSFRAMg02ncTiO24fGbGQZMxK2Xp87fforSSyjcD8tRfQO9Pffb6hftgUanfvgHIkWqAwH1g1kWCZRM5t2cJpKAY=",
            "download_url": "https://onestop.pusan.ac.kr/file/download.do?gOxJPVM6wqGRMRirENffSFRAMg02ncTiO24fGbGQZMxK2Xp87fforSSyjcD8tRfQO9Pffb6hftgUanfvgHIkWqAwH1g1kWCZRM5t2cJpKAY=",
            "type": "pdf",
            "media_type": "application/pdf",
            "file_extension": "pdf"
          },
          {
            "name": "20250304. 2025년 중소기업 취업연계 장학사업 업무처리기준(안).pdf",
            "url": "https://onestop.pusan.ac.kr/file/download.do?gOxJPVM6wqGRMRirENffSFRAMg02ncTiO24fGbGQZMwe/BRFh8n98M7GDSaJ2oVpuN2vuq2Pxmop3uHG/N0jz8nK15AI/7w3OPOOrWmUOgQ=",
            "download_url": "https://onestop.pusan.ac.kr/file/download.do?gOxJPVM6wqGRMRirENffSFRAMg02ncTiO24fGbGQZMwe/BRFh8n98M7GDSaJ2oVpuN2vuq2Pxmop3uHG/N0jz8nK15AI/7w3OPOOrWmUOgQ=",
            "type": "pdf",
            "media_type": "application/pdf",
            "file_extension": "pdf"
          },
          {
            "name": "2_(희리1) 2025년 2학기 신규장학생 학생신청 매뉴얼.pdf",
            "url": "https://onestop.pusan.ac.kr/file/download.do?gOxJPVM6wqGRMRirENffSFRAMg02ncTiO24fGbGQZMybgs95mLw8OgoYfUEaozrna/z6flPcB68rAzFXaLp5BsBe18vO61bx+TDq3+0laxU=",
            "download_url": "https://onestop.pusan.ac.kr/file/download.do?gOxJPVM6wqGRMRirENffSFRAMg02ncTiO24fGbGQZMybgs95mLw8OgoYfUEaozrna/z6flPcB68rAzFXaLp5BsBe18vO61bx+TDq3+0laxU=",
            "type": "pdf",
            "media_type": "application/pdf",
            "file_extension": "pdf"
          },
          {
            "name": "붙임4. 취.창업지원금 사용계획서(취.창업계획서 포함) 서식.hwp",
            "url": "https://onestop.pusan.ac.kr/file/download.do?gOxJPVM6wqGRMRirENffSFRAMg02ncTiO24fGbGQZMxNa4+MBRy+q6Jj75i6rJHc6R+h5VriWsZM8K1FsEcZfGxmDhvejgm8JyLdupLjX+c=",
            "download_url": "https://onestop.pusan.ac.kr/file/download.do?gOxJPVM6wqGRMRirENffSFRAMg02ncTiO24fGbGQZMxNa4+MBRy+q6Jj75i6rJHc6R+h5VriWsZM8K1FsEcZfGxmDhvejgm8JyLdupLjX+c=",
            "type": "hwp",
            "media_type": "application/x-hwp",
            "file_extension": "hwp"
          }
        ],
        "tags": [
          "pnu",
          "official",
          "onestop",
          "scholarship"
        ],
        "content_hash": "15ebde95473d898a2e475dc477af6106cf3cb7cd76a41344a8ad0edbc5649f5f"
      },
      "_archive": {
        "archive_month": "2025-09",
        "first_seen_at": "2026-06-04T22:23:14+09:00",
        "last_seen_at": "2026-06-04T22:23:14+09:00",
        "last_changed_at": "2026-06-04T22:23:14+09:00",
        "current_content_hash": "15ebde95473d898a2e475dc477af6106cf3cb7cd76a41344a8ad0edbc5649f5f"
      }
    }
  ]
}
