{
  "schema_version": "0.1",
  "archive_version": "0.1",
  "archive_type": "notices",
  "archive_month": "2025-12",
  "last_modified_at": "2026-06-04T22:23:14+09:00",
  "timezone": "Asia/Seoul",
  "item_count": 1,
  "source_counts": {
    "pnu-onestop-scholarship": 1
  },
  "items": [
    {
      "id": "pnu-onestop-scholarship:654",
      "url": "https://onestop.pusan.ac.kr/page?menuCD=000000000000062&mode=DETAIL&seq=654",
      "title": "2025학년도 2학기 동계방학 국가근로 사전교육 안내",
      "content_text": "This feed does not mirror the full notice body. Fetch the original notice URL for complete content.",
      "summary": "2025 학년도 2 학기 동계방학 국가근로 사전교육 안내 2025 학년도 2 학기 동계방학 국가근로 사전교육 자료를 안내드리니 근로 이전에 반드시 숙지하여 근로에 임하여 주시기 바랍니다 . - 근로기간 : 2026. 1. 2.( 금 ) ~ 2026. 2. 10( 화 ) ( 근로기관별로 근로기간 및 근로시간이 다르니 확인바랍니다 .) ※ 반드시 2026. 2. 10( 화 ) 까지만 근로하시기 바라며 , 이후 근로 시 장학금 지급 불가 - 근로시간 : 1 일 최대 8 시간 , 주당 최대 40 시간 - 유의사항 . 학적변동 ( 휴학 , 자퇴 , 졸업 등 ) 발생시 근로즉시 중단 및 대학 담당자에게 반드시 통보해야 합니다 . . 안전교육이수보고서는 근로 시작과 동시에 작성하셔서 근로지 담당자 확인 후 재단에 업로드 할 것 .( 학기중 근로한 학생도 근로지 변경 시 반드시 제출해야 됨 ) . 근로기관과 근로장학생간 상호평가를 해야 출근부 승인 가능하니 반드시 평가 할 것 . ( 근로시간이 4",
      "date_published": "2025-12-14T00:00:00+09:00",
      "_pnu": {
        "source_id": "pnu-onestop-scholarship",
        "source_name": "부산대 장학공지",
        "published_at": "2025-12-14",
        "fetched_at": "2026-06-04T22:23:14+09:00",
        "snippet": "2025 학년도 2 학기 동계방학 국가근로 사전교육 안내 2025 학년도 2 학기 동계방학 국가근로 사전교육 자료를 안내드리니 근로 이전에 반드시 숙지하여 근로에 임하여 주시기 바랍니다 . - 근로기간 : 2026. 1. 2.( 금 ) ~ 2026. 2. 10( 화 ) ( 근로기관별로 근로기간 및 근로시간이 다르니 확인바랍니다 .) ※ 반드시 2026. 2. 10( 화 ) 까지만 근로하시기 바라며 , 이후 근로 시 장학금 지급 불가 - 근로시간 : 1 일 최대 8 시간 , 주당 최대 40 시간 - 유의사항 . 학적변동 ( 휴학 , 자퇴 , 졸업 등 ) 발생시 근로즉시 중단 및 대학 담당자에게 반드시 통보해야 합니다 . . 안전교육이수보고서는 근로 시작과 동시에 작성하셔서 근로지 담당자 확인 후 재단에 업로드 할 것 .( 학기중 근로한 학생도 근로지 변경 시 반드시 제출해야 됨 ) . 근로기관과 근로장학생간 상호평가를 해야 출근부 승인 가능하니 반드시 평가 할 것 . ( 근로시간이 4",
        "content_access": {
          "detail_url": "https://onestop.pusan.ac.kr/page?menuCD=000000000000062&mode=DETAIL&seq=654",
          "requires_login": false,
          "content_mirrored": false,
          "attachments_mirrored": false
        },
        "attachments": [
          {
            "name": "2025 동계집중근로안내.pdf",
            "url": "https://onestop.pusan.ac.kr/file/download.do?eFyCe/m+J2YfGlr7RbGkg5vXO8lA1E2P7QKkGzO0aVetZLzhaJupzAxO/DvHNj8YGzLd1nFD5z6kKujhsmz+AtrnuMtsbQt18wyUMsTw95Y=",
            "download_url": "https://onestop.pusan.ac.kr/file/download.do?eFyCe/m+J2YfGlr7RbGkg5vXO8lA1E2P7QKkGzO0aVetZLzhaJupzAxO/DvHNj8YGzLd1nFD5z6kKujhsmz+AtrnuMtsbQt18wyUMsTw95Y=",
            "type": "pdf",
            "media_type": "application/pdf",
            "file_extension": "pdf"
          }
        ],
        "tags": [
          "pnu",
          "official",
          "onestop",
          "scholarship"
        ],
        "content_hash": "4dc0707ce2fe43c80d822dfda295050aaf922768fa124cdf2af7fe07e17d749f"
      },
      "_archive": {
        "archive_month": "2025-12",
        "first_seen_at": "2026-06-04T22:23:14+09:00",
        "last_seen_at": "2026-06-04T22:23:14+09:00",
        "last_changed_at": "2026-06-04T22:23:14+09:00",
        "current_content_hash": "4dc0707ce2fe43c80d822dfda295050aaf922768fa124cdf2af7fe07e17d749f"
      }
    }
  ]
}
